{"runtime":"claude-code","schema_version":"catena.coding_agent.event_graph.v1","session_id":"11111111-1111-4111-8111-111111111111","source":{"format":"claude-transcript-jsonl","parser":"langfuse-claude-derived@5b3d432","path":"transcript.jsonl","upstream_commit":"5b3d4323c49f3839545fad36883ed02420ebc0ba"},"traces":[{"accounting":[{"disposition":"span","event_id":"transcript.jsonl:4a1b7ca44d3f:row:10000000-0000-4000-8000-000000000001","node_key":"main:turn:10000000-0000-4000-8000-000000000001"},{"disposition":"span","event_id":"transcript.jsonl:4a1b7ca44d3f:row:20000000-0000-4000-8000-000000000001","node_key":"main:turn:10000000-0000-4000-8000-000000000001:model:msg_plain"}],"nodes":[{"attributes":{"agent.turn.id":"10000000-0000-4000-8000-000000000001","agent.turn.model_calls":1,"agent.turn.retries":0,"agent.turn.tool_calls":0,"claude.user.uuid":"10000000-0000-4000-8000-000000000001"},"end_time_unix_nano":"1786669201000000000","input":"[redacted] ordinary turn","key":"main:turn:10000000-0000-4000-8000-000000000001","kind":"turn","name":"agent.turn","output":"[redacted] ordinary response","runtime_id":"10000000-0000-4000-8000-000000000001","source_event_ids":["transcript.jsonl:4a1b7ca44d3f:row:10000000-0000-4000-8000-000000000001","transcript.jsonl:4a1b7ca44d3f:row:20000000-0000-4000-8000-000000000001"],"start_time_unix_nano":"1786669200000000000","state":"ok"},{"attributes":{"catena.model.step.index":0,"gen_ai.request.id":"req_plain"},"end_time_unix_nano":"1786669201000000000","input":"[redacted] ordinary turn","key":"main:turn:10000000-0000-4000-8000-000000000001:model:msg_plain","kind":"model","model":"claude-sonnet-4-5","name":"gen_ai.model.call","output":{"content":"[redacted] ordinary response"},"parent_key":"main:turn:10000000-0000-4000-8000-000000000001","runtime_id":"msg_plain","source_event_ids":["transcript.jsonl:4a1b7ca44d3f:row:20000000-0000-4000-8000-000000000001"],"start_time_unix_nano":"1786669201000000000","state":"ok","usage":{"input":10,"output":5}}],"state":"ok","trace_id":"85dcdb36075ab705a27a66ecb18e0562","turn_id":"10000000-0000-4000-8000-000000000001"},{"accounting":[{"disposition":"span","event_id":"transcript.jsonl:4a1b7ca44d3f:row:10000000-0000-4000-8000-000000000002","node_key":"main:turn:10000000-0000-4000-8000-000000000002"},{"disposition":"span","event_id":"transcript.jsonl:4a1b7ca44d3f:row:20000000-0000-4000-8000-000000000002","node_key":"main:turn:10000000-0000-4000-8000-000000000002:tool:toolu_single"},{"disposition":"span","event_id":"transcript.jsonl:4a1b7ca44d3f:row:30000000-0000-4000-8000-000000000001","node_key":"main:turn:10000000-0000-4000-8000-000000000002:tool:toolu_single"},{"disposition":"span","event_id":"transcript.jsonl:4a1b7ca44d3f:row:20000000-0000-4000-8000-000000000003","node_key":"main:turn:10000000-0000-4000-8000-000000000002:model:msg_single_2"}],"nodes":[{"attributes":{"agent.turn.id":"10000000-0000-4000-8000-000000000002","agent.turn.model_calls":2,"agent.turn.retries":0,"agent.turn.tool_calls":1,"claude.user.uuid":"10000000-0000-4000-8000-000000000002"},"end_time_unix_nano":"1786669263000000000","input":"[redacted] one tool","key":"main:turn:10000000-0000-4000-8000-000000000002","kind":"turn","name":"agent.turn","output":"[redacted] used tool result","runtime_id":"10000000-0000-4000-8000-000000000002","source_event_ids":["transcript.jsonl:4a1b7ca44d3f:row:10000000-0000-4000-8000-000000000002","transcript.jsonl:4a1b7ca44d3f:row:20000000-0000-4000-8000-000000000002","transcript.jsonl:4a1b7ca44d3f:row:30000000-0000-4000-8000-000000000001","transcript.jsonl:4a1b7ca44d3f:row:20000000-0000-4000-8000-000000000003"],"start_time_unix_nano":"1786669260000000000","state":"ok"},{"attributes":{"catena.model.step.index":0,"gen_ai.request.id":"req_single_1"},"end_time_unix_nano":"1786669261000000000","input":"[redacted] one tool","key":"main:turn:10000000-0000-4000-8000-000000000002:model:msg_single_1","kind":"model","model":"claude-sonnet-4-5","name":"gen_ai.model.call","output":{"tool_calls":[{"arguments":{"command":"printf redacted"},"id":"toolu_single","name":"Bash"}]},"parent_key":"main:turn:10000000-0000-4000-8000-000000000002","runtime_id":"msg_single_1","source_event_ids":["transcript.jsonl:4a1b7ca44d3f:row:20000000-0000-4000-8000-000000000002"],"start_time_unix_nano":"1786669261000000000","state":"ok","usage":{"input":15,"output":8}},{"attributes":{"gen_ai.tool.call.id":"toolu_single","gen_ai.tool.name":"Bash","gen_ai.tool.type":"local_shell"},"end_time_unix_nano":"1786669262000000000","input":{"command":"printf redacted"},"key":"main:turn:10000000-0000-4000-8000-000000000002:tool:toolu_single","kind":"tool","name":"agent.tool.call Bash","output":"[redacted] command output","parent_key":"main:turn:10000000-0000-4000-8000-000000000002:model:msg_single_1","runtime_id":"toolu_single","source_event_ids":["transcript.jsonl:4a1b7ca44d3f:row:20000000-0000-4000-8000-000000000002","transcript.jsonl:4a1b7ca44d3f:row:30000000-0000-4000-8000-000000000001"],"start_time_unix_nano":"1786669261000000000","state":"ok"},{"attributes":{"catena.model.step.index":1,"gen_ai.request.id":"req_single_2"},"end_time_unix_nano":"1786669263000000000","input":[{"call_id":"toolu_single","content":"[redacted] command output","is_error":false}],"key":"main:turn:10000000-0000-4000-8000-000000000002:model:msg_single_2","kind":"model","model":"claude-sonnet-4-5","name":"gen_ai.model.call","output":{"content":"[redacted] used tool result"},"parent_key":"main:turn:10000000-0000-4000-8000-000000000002","runtime_id":"msg_single_2","source_event_ids":["transcript.jsonl:4a1b7ca44d3f:row:20000000-0000-4000-8000-000000000003"],"start_time_unix_nano":"1786669263000000000","state":"ok","usage":{"input":24,"output":6}}],"state":"ok","trace_id":"ee6411b573e586be511dac829eef9ea0","turn_id":"10000000-0000-4000-8000-000000000002"},{"accounting":[{"disposition":"span","event_id":"transcript.jsonl:4a1b7ca44d3f:row:10000000-0000-4000-8000-000000000003","node_key":"main:turn:10000000-0000-4000-8000-000000000003"},{"disposition":"span","event_id":"transcript.jsonl:4a1b7ca44d3f:row:20000000-0000-4000-8000-000000000004","node_key":"main:turn:10000000-0000-4000-8000-000000000003:tool:toolu_serial_1"},{"disposition":"span","event_id":"transcript.jsonl:4a1b7ca44d3f:row:30000000-0000-4000-8000-000000000002","node_key":"main:turn:10000000-0000-4000-8000-000000000003:tool:toolu_serial_1"},{"disposition":"span","event_id":"transcript.jsonl:4a1b7ca44d3f:row:20000000-0000-4000-8000-000000000005","node_key":"main:turn:10000000-0000-4000-8000-000000000003:tool:toolu_serial_2"},{"disposition":"span","event_id":"transcript.jsonl:4a1b7ca44d3f:row:30000000-0000-4000-8000-000000000003","node_key":"main:turn:10000000-0000-4000-8000-000000000003:tool:toolu_serial_2"},{"disposition":"span","event_id":"transcript.jsonl:4a1b7ca44d3f:row:20000000-0000-4000-8000-000000000006","node_key":"main:turn:10000000-0000-4000-8000-000000000003:model:msg_serial_3"}],"nodes":[{"attributes":{"agent.turn.id":"10000000-0000-4000-8000-000000000003","agent.turn.model_calls":3,"agent.turn.retries":0,"agent.turn.tool_calls":2,"claude.user.uuid":"10000000-0000-4000-8000-000000000003"},"end_time_unix_nano":"1786669325000000000","input":"[redacted] two serial tools","key":"main:turn:10000000-0000-4000-8000-000000000003","kind":"turn","name":"agent.turn","output":"[redacted] serial tools complete","runtime_id":"10000000-0000-4000-8000-000000000003","source_event_ids":["transcript.jsonl:4a1b7ca44d3f:row:10000000-0000-4000-8000-000000000003","transcript.jsonl:4a1b7ca44d3f:row:20000000-0000-4000-8000-000000000004","transcript.jsonl:4a1b7ca44d3f:row:30000000-0000-4000-8000-000000000002","transcript.jsonl:4a1b7ca44d3f:row:20000000-0000-4000-8000-000000000005","transcript.jsonl:4a1b7ca44d3f:row:30000000-0000-4000-8000-000000000003","transcript.jsonl:4a1b7ca44d3f:row:20000000-0000-4000-8000-000000000006"],"start_time_unix_nano":"1786669320000000000","state":"ok"},{"attributes":{"catena.model.step.index":0,"gen_ai.request.id":"req_serial_1"},"end_time_unix_nano":"1786669321000000000","input":"[redacted] two serial tools","key":"main:turn:10000000-0000-4000-8000-000000000003:model:msg_serial_1","kind":"model","model":"claude-sonnet-4-5","name":"gen_ai.model.call","output":{"tool_calls":[{"arguments":{"command":"first-redacted"},"id":"toolu_serial_1","name":"Bash"}]},"parent_key":"main:turn:10000000-0000-4000-8000-000000000003","runtime_id":"msg_serial_1","source_event_ids":["transcript.jsonl:4a1b7ca44d3f:row:20000000-0000-4000-8000-000000000004"],"start_time_unix_nano":"1786669321000000000","state":"ok","usage":{"input":20,"output":7}},{"attributes":{"gen_ai.tool.call.id":"toolu_serial_1","gen_ai.tool.name":"Bash","gen_ai.tool.type":"local_shell"},"end_time_unix_nano":"1786669322000000000","input":{"command":"first-redacted"},"key":"main:turn:10000000-0000-4000-8000-000000000003:tool:toolu_serial_1","kind":"tool","name":"agent.tool.call Bash","output":"[redacted] first result","parent_key":"main:turn:10000000-0000-4000-8000-000000000003:model:msg_serial_1","runtime_id":"toolu_serial_1","source_event_ids":["transcript.jsonl:4a1b7ca44d3f:row:20000000-0000-4000-8000-000000000004","transcript.jsonl:4a1b7ca44d3f:row:30000000-0000-4000-8000-000000000002"],"start_time_unix_nano":"1786669321000000000","state":"ok"},{"attributes":{"catena.model.step.index":1,"gen_ai.request.id":"req_serial_2"},"end_time_unix_nano":"1786669323000000000","input":[{"call_id":"toolu_serial_1","content":"[redacted] first result","is_error":false}],"key":"main:turn:10000000-0000-4000-8000-000000000003:model:msg_serial_2","kind":"model","model":"claude-sonnet-4-5","name":"gen_ai.model.call","output":{"tool_calls":[{"arguments":{"file_path":"/redacted/input.txt"},"id":"toolu_serial_2","name":"Read"}]},"parent_key":"main:turn:10000000-0000-4000-8000-000000000003","runtime_id":"msg_serial_2","source_event_ids":["transcript.jsonl:4a1b7ca44d3f:row:20000000-0000-4000-8000-000000000005"],"start_time_unix_nano"